{
  "contract_id": "repo-mode-b/v0.1.0",
  "mode": "B",
  "allowed_roots": [
    "cbia-content",
    "content",
    "control"
  ],
  "builder_snapshot": {
    "root": "cbia-content",
    "required_paths": [
      "inf1220/objectives",
      "inf1220/material"
    ]
  },
  "consumer_view": {
    "manifest_path": "content/manifest.json",
    "material_root": "content/material"
  },
  "forbidden_globs": [
    "**/*#U00e*",
    "**/.DS_Store",
    "**/__MACOSX/**"
  ],
  "evidence_outputs": {
    "repo_mode_b_check": "control/evidence/repo_mode_b_check.json"
  }
}
